<?xml version="1.0" encoding="UTF-8" standalone="no"?>
<candies xmlns:xsi="http://www.w3.org/2001/XMLSchema-instance"
         xmlns="http://www.example.com/candies"
         xsi:schemaLocation="http://www.example.com/candies candies.xsd">
    <candy>
        <name>Mars</name>
        <energy>1000</energy>
        <types>
            <type name="chocolate" withFilling="true"/>
        </types>
        <ingredients>
            <ingredient name="sugar" weight="112"/>
            <ingredient name="vanillin" weight="25"/>
            <ingredient name="milk" weight="33" kind="powdered"/>
        </ingredients>
        <value proteins="10" fats="13" carbohydrates="44"/>
        <production>Mars, Incorporated</production>
    </candy>


</candies>